{
  "coverage_kind": "selection-snapshot",
  "coverage_observed_at": "2026-08-13T06:05:00+09:00",
  "dek": "委任の来歴を追う安全設計と、難しい環境でのエージェント評価を深掘りし、AI利用計測、IDE、モデル、CMS更新を短報で追う。",
  "edition_date": "2026-08-13",
  "edition_id": "2026-08-13-0051",
  "edition_note": "一次情報6件を直接確認したレビュー候補。深掘り2件、Brief/Watch 4件。4ドメイン・3ソース種別を満たし、公開操作は行っていない。",
  "generated_at": "2026-08-13T06:05:00+09:00",
  "items": [
    {
      "aoi_note": "権限委任では、最終状態だけでなく操作の来歴を実行時ポリシーへ残す。",
      "caveat": "arXiv v1の著者報告で独立検証前。構造化された実験条件の結果を実環境一般へ外挿できず、製品安全性を証明しない。",
      "change": {
        "kind": "new"
      },
      "context_ids": [],
      "id": "polis-institutional-multi-agent-safety",
      "language": "en",
      "observed_at": "2026-08-12T15:51:22Z",
      "published_at": "2026-08-10T16:47:01Z",
      "role": "lead",
      "selection_reason": "単体モデルの善し悪しではなく、委任、来歴、制約開示を制度として試す設計を具体化している。",
      "source_domain": "arxiv.org",
      "source_fact": "POLIS研究は5,280エピソードの試験群を報告し、事前指定の委任実験では詳細な憲法プロンプトと来歴対応ガードが各0/384の実現違反だった。来歴対応ガードは51/384件を遮断し、その後44件が安全に完了したと著者らは報告する。",
      "source_kind": "paper",
      "source_title": "Multi-Agent AI Safety as an Institutional Design Problem",
      "source_url": "https://arxiv.org/abs/2608.09828v1",
      "title": "マルチエージェント安全性を「制度設計」として検証する",
      "topics": [
        "agents",
        "security",
        "research"
      ],
      "verification": {
        "checked_at": "2026-08-12T15:51:22Z",
        "status": "verified"
      }
    },
    {
      "aoi_note": "ゲーム評価でも、勝敗の二値だけでなく部分的進歩と失敗様式を記録する。",
      "caveat": "arXiv v1の著者報告。実装詳細、試行数、信頼区間は要旨だけでは確認できず、全22体試験の一部は有利なレベル50条件を使う。",
      "change": {
        "kind": "new"
      },
      "context_ids": [],
      "id": "dsle-dark-souls-agent-benchmark",
      "language": "en",
      "observed_at": "2026-08-12T15:51:22Z",
      "published_at": "2026-08-10T17:48:45Z",
      "role": "major",
      "selection_reason": "成功率だけでは見えない、生存時間や与ダメージを含むエージェント評価の難しさを示す。",
      "source_domain": "arxiv.org",
      "source_fact": "DSLEはDark Souls: Remasteredの全22ボス戦をGymnasium形式で公開するコンテナ型環境を提案する。DSLE-5では専門家システムと進化的手法がAsylum Demonで最高63%と43%の勝率を報告した一方、他4体は倒せなかった。",
      "source_kind": "paper",
      "source_title": "A Learning Environment for Dark Souls Boss Encounters",
      "source_url": "https://arxiv.org/abs/2608.09902v1",
      "title": "Dark Souls全22ボスを、視覚エージェントの難関ベンチマークにする",
      "topics": [
        "agents",
        "research",
        "open-source"
      ],
      "verification": {
        "checked_at": "2026-08-12T15:51:22Z",
        "status": "verified"
      }
    },
    {
      "aoi_note": "モデル別の品質指標とトークン内訳を同じ運用レポートで比較したい。",
      "caveat": "GitHubの製品発表であり、利用可能範囲や課金への反映は契約・プラン・将来の仕様変更に依存する。",
      "change": {
        "kind": "new"
      },
      "context_ids": [],
      "id": "github-copilot-per-model-token-report",
      "language": "en",
      "observed_at": "2026-08-12T15:51:22Z",
      "published_at": "2026-08-11T00:00:00Z",
      "role": "brief",
      "selection_reason": "AIコストを総額だけでなく、モデル選択とキャッシュ挙動へ分解して改善できる。",
      "source_domain": "github.blog",
      "source_fact": "GitHubはAI usage reportにモデル別の入力、出力、キャッシュ読み取り、キャッシュ書き込みトークンの内訳を追加した。",
      "source_kind": "release",
      "source_title": "Per-model token breakdown in the usage report",
      "source_url": "https://github.blog/changelog/2026-08-11-per-model-token-breakdown-in-the-usage-report/",
      "title": "CopilotのAI利用量を、モデル別・トークン種別で分解できる",
      "topics": [
        "tools",
        "models"
      ],
      "verification": {
        "checked_at": "2026-08-12T15:51:22Z",
        "status": "verified"
      }
    },
    {
      "aoi_note": "モデル更新は平均的な改善だけでなく、評価条件、提供面、利用者層を分けて確認する。",
      "caveat": "OpenAIの内部評価であり独立検証ではない。誤り率の比較は記載された金融・医療・法務プロンプト群に限られ、APIやCodex/Work向けモデルの更新ではない。",
      "change": {
        "kind": "new"
      },
      "context_ids": [],
      "id": "openai-gpt-56-sol-chat-update",
      "language": "en",
      "observed_at": "2026-08-13T06:05:00+09:00",
      "published_at": "2026-08-07T00:00:00Z",
      "role": "brief",
      "selection_reason": "ChatGPTの回答品質、思考量の選択、無料利用者への提供範囲が同時に変わる具体的な更新だから。",
      "source_domain": "openai.com",
      "source_fact": "OpenAIはChatGPT向けGPT-5.6 Solを更新し、Plus/Pro利用者に思考量スライダーを追加した。内部評価では、事実誤りを1件以上含む回答がGPT-5.5 Instant比でGPT-5.6 Solは約68%少なかったと報告している。無料利用者にはGPT-5.6 Lunaの無制限テキストチャットとThinkボタンを順次提供する。",
      "source_kind": "release",
      "source_title": "Improving GPT-5.6 Sol in ChatGPT—and expanding access to GPT-5.6 Luna for free users",
      "source_url": "https://openai.com/index/improving-gpt-5-6-sol-in-chatgpt/",
      "title": "ChatGPTのGPT-5.6 Solを更新、無料版はLunaの無制限テキストへ",
      "topics": [
        "models",
        "tools"
      ],
      "verification": {
        "checked_at": "2026-08-13T06:05:00+09:00",
        "status": "verified"
      }
    },
    {
      "aoi_note": "永続メモリは便利さではなく、保存対象、削除、監査、プロジェクト分離から設計する。",
      "caveat": "メモリの保存範囲、データ境界、管理者設定、対応IDE・バージョンは導入前の確認が必要。",
      "change": {
        "kind": "new"
      },
      "context_ids": [],
      "id": "github-copilot-jetbrains-memory-ollama",
      "language": "en",
      "observed_at": "2026-08-12T15:51:22Z",
      "published_at": "2026-08-11T00:00:00Z",
      "role": "watch",
      "selection_reason": "クラウド支援、ローカル推論、継続コンテキストをIDE内で組み合わせる運用が現実的になる。",
      "source_domain": "github.blog",
      "source_fact": "GitHubはCopilot for JetBrainsへ永続メモリ、Ollamaによるローカルモデル接続、企業向け制御を追加し、MCP関連を含む信頼性改善も案内した。",
      "source_kind": "release",
      "source_title": "Copilot memory and Ollama in GitHub Copilot for JetBrains",
      "source_url": "https://github.blog/changelog/2026-08-11-copilot-memory-and-ollama-in-github-copilot-for-jetbrains/",
      "title": "JetBrains版Copilotに永続メモリとローカルモデル接続",
      "topics": [
        "tools",
        "agents",
        "open-source"
      ],
      "verification": {
        "checked_at": "2026-08-12T15:51:22Z",
        "status": "verified"
      }
    },
    {
      "aoi_note": "公開基盤の緊急更新は、バックアップ、段階適用、疎通確認、ロールバックを一組にする。",
      "caveat": "更新前にバックアップ、プラグイン互換性、ステージング確認が必要。個別脆弱性の影響は構成によって異なる。",
      "change": {
        "kind": "new"
      },
      "context_ids": [],
      "id": "wordpress-704-security-release",
      "language": "en",
      "observed_at": "2026-08-12T15:51:22Z",
      "published_at": "2026-08-12T00:00:00Z",
      "role": "watch",
      "selection_reason": "AIサイトやコンテンツ基盤も、生成機能より先に公開CMSの既知リスクを閉じる必要がある。",
      "source_domain": "wordpress.org",
      "source_fact": "WordPress.orgは7.0.4をセキュリティリリースとして公開し、サイト管理者へ直ちに更新するよう推奨した。",
      "source_kind": "advisory",
      "source_title": "WordPress 7.0.4 Release",
      "source_url": "https://wordpress.org/news/2026/08/wordpress-7-0-4-release/",
      "title": "WordPress 7.0.4は即時更新推奨のセキュリティリリース",
      "topics": [
        "security",
        "tools"
      ],
      "verification": {
        "checked_at": "2026-08-12T15:51:22Z",
        "status": "verified"
      }
    }
  ],
  "publication_status": "public",
  "published_at": "2026-08-13T06:05:00+09:00",
  "schema_version": "aoi.news.edition.v1",
  "title": "AOIFUTURE News — エージェントを「制度」と「失敗」で評価する",
  "topics": [
    {
      "description": "権限、記憶、ツール、実行環境を含むエージェント設計。",
      "id": "agents",
      "label_en": "Agents",
      "label_ja": "AIエージェント"
    },
    {
      "description": "AIと公開システムの攻撃耐性、更新、監査。",
      "id": "security",
      "label_en": "Security",
      "label_ja": "セキュリティ"
    },
    {
      "id": "research",
      "label_en": "一次論文の手法、実験、限界。",
      "label_ja": "研究"
    },
    {
      "id": "tools",
      "label_en": "開発・運用を具体化する製品とワークフロー。",
      "label_ja": "ツール"
    },
    {
      "id": "models",
      "label_en": "モデルの機能、提供条件、利用計測。",
      "label_ja": "モデル"
    },
    {
      "id": "open-source",
      "label_en": "ローカル実行や再利用可能な公開実装。",
      "label_ja": "オープンソース"
    }
  ]
}
